{
  "level": "Elementary",
  "version": "1.0",
  "description": "Elementary level Nepali learning data",
  "flashcards": [
    {
      "id": "elementary_vocab_travel_001",
      "front": "यात्रा",
      "back": "Travel/Journey",
      "romanization": "yatra",
      "meaning": "Travel or journey",
      "level": "Elementary",
      "category": "travel",
      "examples": [
        "यात्रा ।"
      ],
      "isFavorite": false,
      "reviewCount": 0,
      "correctCount": 0
    },
    {
      "id": "elementary_vocab_travel_002",
      "front": "टिकट",
      "back": "Ticket",
      "romanization": "tikat",
      "meaning": "Ticket",
      "level": "Elementary",
      "category": "travel",
      "examples": [
        "टिकट ।"
      ],
      "isFavorite": false,
      "reviewCount": 0,
      "correctCount": 0
    },
    {
      "id": "elementary_vocab_travel_003",
      "front": "बस",
      "back": "Bus",
      "romanization": "bas",
      "meaning": "Bus",
      "level": "Elementary",
      "category": "travel",
      "examples": [
        "बस ।"
      ],
      "isFavorite": false,
      "reviewCount": 0,
      "correctCount": 0
    },
    {
      "id": "elementary_vocab_travel_004",
      "front": "गाडी",
      "back": "Car/Vehicle",
      "romanization": "gadi",
      "meaning": "Car or vehicle",
      "level": "Elementary",
      "category": "travel",
      "examples": [
        "गाडी ।"
      ],
      "isFavorite": false,
      "reviewCount": 0,
      "correctCount": 0
    },
    {
      "id": "elementary_vocab_travel_005",
      "front": "रेल",
      "back": "Train",
      "romanization": "rel",
      "meaning": "Train",
      "level": "Elementary",
      "category": "travel",
      "examples": [
        "रेल ।"
      ],
      "isFavorite": false,
      "reviewCount": 0,
      "correctCount": 0
    },
    {
      "id": "elementary_vocab_travel_006",
      "front": "सडक",
      "back": "Road",
      "romanization": "sadak",
      "meaning": "Road",
      "level": "Elementary",
      "category": "travel",
      "examples": [
        "सडक ।"
      ],
      "isFavorite": false,
      "reviewCount": 0,
      "correctCount": 0
    },
    {
      "id": "elementary_vocab_travel_007",
      "front": "नक्सा",
      "back": "Map",
      "romanization": "naksha",
      "meaning": "Map",
      "level": "Elementary",
      "category": "travel",
      "examples": [
        "नक्सा ।"
      ],
      "isFavorite": false,
      "reviewCount": 0,
      "correctCount": 0
    },
    {
      "id": "elementary_vocab_travel_008",
      "front": "मार्ग",
      "back": "Route/Path",
      "romanization": "marga",
      "meaning": "Route or path",
      "level": "Elementary",
      "category": "travel",
      "examples": [
        "मार्ग ।"
      ],
      "isFavorite": false,
      "reviewCount": 0,
      "correctCount": 0
    },
    {
      "id": "elementary_vocab_travel_009",
      "front": "यात्री",
      "back": "Traveler",
      "romanization": "yatri",
      "meaning": "Traveler",
      "level": "Elementary",
      "category": "travel",
      "examples": [
        "यात्री ।"
      ],
      "isFavorite": false,
      "reviewCount": 0,
      "correctCount": 0
    },
    {
      "id": "elementary_vocab_travel_010",
      "front": "सामान",
      "back": "Luggage",
      "romanization": "saman",
      "meaning": "Luggage",
      "level": "Elementary",
      "category": "travel",
      "examples": [
        "सामान ।"
      ],
      "isFavorite": false,
      "reviewCount": 0,
      "correctCount": 0
    },
    {
      "id": "elementary_vocab_travel_011",
      "front": "पासपोर्ट",
      "back": "Passport",
      "romanization": "passport",
      "meaning": "Passport",
      "level": "Elementary",
      "category": "travel",
      "examples": [
        "पासपोर्ट ।"
      ],
      "isFavorite": false,
      "reviewCount": 0,
      "correctCount": 0
    },
    {
      "id": "elementary_vocab_travel_012",
      "front": "भिसा",
      "back": "Visa",
      "romanization": "visa",
      "meaning": "Visa",
      "level": "Elementary",
      "category": "travel",
      "examples": [
        "भिसा ।"
      ],
      "isFavorite": false,
      "reviewCount": 0,
      "correctCount": 0
    },
    {
      "id": "elementary_vocab_weather_013",
      "front": "मौसम",
      "back": "Weather",
      "romanization": "mausam",
      "meaning": "Weather",
      "level": "Elementary",
      "category": "weather",
      "examples": [
        "मौसम ।"
      ],
      "isFavorite": false,
      "reviewCount": 0,
      "correctCount": 0
    },
    {
      "id": "elementary_vocab_weather_014",
      "front": "घाम",
      "back": "Sun",
      "romanization": "gham",
      "meaning": "Sun/Sunshine",
      "level": "Elementary",
      "category": "weather",
      "examples": [
        "घाम ।"
      ],
      "isFavorite": false,
      "reviewCount": 0,
      "correctCount": 0
    },
    {
      "id": "elementary_vocab_weather_015",
      "front": "पानी परेको",
      "back": "Raining",
      "romanization": "pani pareko",
      "meaning": "It's raining",
      "level": "Elementary",
      "category": "weather",
      "examples": [
        "पानी परेको ।"
      ],
      "isFavorite": false,
      "reviewCount": 0,
      "correctCount": 0
    },
    {
      "id": "elementary_vocab_weather_016",
      "front": "बादल",
      "back": "Cloud",
      "romanization": "badal",
      "meaning": "Cloud",
      "level": "Elementary",
      "category": "weather",
      "examples": [
        "बादल ।"
      ],
      "isFavorite": false,
      "reviewCount": 0,
      "correctCount": 0
    },
    {
      "id": "elementary_vocab_weather_017",
      "front": "हावा",
      "back": "Wind",
      "romanization": "hawa",
      "meaning": "Wind",
      "level": "Elementary",
      "category": "weather",
      "examples": [
        "हावा ।"
      ],
      "isFavorite": false,
      "reviewCount": 0,
      "correctCount": 0
    },
    {
      "id": "elementary_vocab_weather_018",
      "front": "हिउँ",
      "back": "Snow",
      "romanization": "hiun",
      "meaning": "Snow",
      "level": "Elementary",
      "category": "weather",
      "examples": [
        "हिउँ ।"
      ],
      "isFavorite": false,
      "reviewCount": 0,
      "correctCount": 0
    },
    {
      "id": "elementary_vocab_weather_019",
      "front": "गर्मी",
      "back": "Hot weather",
      "romanization": "garmi",
      "meaning": "Hot weather",
      "level": "Elementary",
      "category": "weather",
      "examples": [
        "गर्मी ।"
      ],
      "isFavorite": false,
      "reviewCount": 0,
      "correctCount": 0
    },
    {
      "id": "elementary_vocab_weather_020",
      "front": "जाडो",
      "back": "Cold weather",
      "romanization": "jado",
      "meaning": "Cold weather",
      "level": "Elementary",
      "category": "weather",
      "examples": [
        "जाडो ।"
      ],
      "isFavorite": false,
      "reviewCount": 0,
      "correctCount": 0
    },
    {
      "id": "elementary_vocab_weather_021",
      "front": "वर्षा",
      "back": "Rain",
      "romanization": "barsha",
      "meaning": "Rain",
      "level": "Elementary",
      "category": "weather",
      "examples": [
        "वर्षा ।"
      ],
      "isFavorite": false,
      "reviewCount": 0,
      "correctCount": 0
    },
    {
      "id": "elementary_vocab_weather_022",
      "front": "तुषारो",
      "back": "Fog",
      "romanization": "tusaro",
      "meaning": "Fog",
      "level": "Elementary",
      "category": "weather",
      "examples": [
        "तुषारो ।"
      ],
      "isFavorite": false,
      "reviewCount": 0,
      "correctCount": 0
    },
    {
      "id": "elementary_vocab_body_023",
      "front": "शरीर",
      "back": "Body",
      "romanization": "sharir",
      "meaning": "Body",
      "level": "Elementary",
      "category": "body",
      "examples": [
        "शरीर ।"
      ],
      "isFavorite": false,
      "reviewCount": 0,
      "correctCount": 0
    },
    {
      "id": "elementary_vocab_body_024",
      "front": "टाउको",
      "back": "Head",
      "romanization": "tauko",
      "meaning": "Head",
      "level": "Elementary",
      "category": "body",
      "examples": [
        "टाउको ।"
      ],
      "isFavorite": false,
      "reviewCount": 0,
      "correctCount": 0
    },
    {
      "id": "elementary_vocab_body_025",
      "front": "आँखा",
      "back": "Eye",
      "romanization": "aankha",
      "meaning": "Eye",
      "level": "Elementary",
      "category": "body",
      "examples": [
        "आँखा ।"
      ],
      "isFavorite": false,
      "reviewCount": 0,
      "correctCount": 0
    },
    {
      "id": "elementary_vocab_body_026",
      "front": "कान",
      "back": "Ear",
      "romanization": "kaan",
      "meaning": "Ear",
      "level": "Elementary",
      "category": "body",
      "examples": [
        "कान ।"
      ],
      "isFavorite": false,
      "reviewCount": 0,
      "correctCount": 0
    },
    {
      "id": "elementary_vocab_body_027",
      "front": "नाक",
      "back": "Nose",
      "romanization": "nak",
      "meaning": "Nose",
      "level": "Elementary",
      "category": "body",
      "examples": [
        "नाक ।"
      ],
      "isFavorite": false,
      "reviewCount": 0,
      "correctCount": 0
    },
    {
      "id": "elementary_vocab_body_028",
      "front": "मुख",
      "back": "Mouth",
      "romanization": "mukh",
      "meaning": "Mouth",
      "level": "Elementary",
      "category": "body",
      "examples": [
        "मुख ।"
      ],
      "isFavorite": false,
      "reviewCount": 0,
      "correctCount": 0
    },
    {
      "id": "elementary_vocab_body_029",
      "front": "हात",
      "back": "Hand",
      "romanization": "haat",
      "meaning": "Hand",
      "level": "Elementary",
      "category": "body",
      "examples": [
        "हात ।"
      ],
      "isFavorite": false,
      "reviewCount": 0,
      "correctCount": 0
    },
    {